{
  "$schema": "./schema.json",
  "name": "cave",
  "description": "A 5.3 m x 3 m room: front, left and right walls plus floor and ceiling, one computer per screen. Viewer stands at the origin, floor at y = 0.",
  "fps": 60,
  "sync": "barrier",
  "defaultHead": { "position": [0, 1.6, 0] },
  "app": { "name": "shapes" },
  "screens": [
    { "id": "front", "center": [0, 1.5, -1.5], "width": 5.3, "height": 3, "yaw": 0,   "widthPx": 1920, "heightPx": 1080 },
    { "id": "left",  "center": [-2.65, 1.5, 1.15], "width": 5.3, "height": 3, "yaw": 90,  "widthPx": 1920, "heightPx": 1080 },
    { "id": "right", "center": [2.65, 1.5, 1.15], "width": 5.3, "height": 3, "yaw": -90, "widthPx": 1920, "heightPx": 1080 },
    { "id": "floor", "center": [0, 0, 0],      "width": 5.3, "height": 3, "pitch": -90, "widthPx": 1920, "heightPx": 1080 },
    { "id": "ceiling", "center": [0, 3, 0],    "width": 5.3, "height": 3, "pitch": 90,  "widthPx": 1920, "heightPx": 1080 }
  ],
  "nodes": [
    { "id": "front", "screens": ["front"] , "audio":true},
    { "id": "left",  "screens": ["left"] },
    { "id": "right", "screens": ["right"] },
    { "id": "floor", "screens": ["floor"] },
    { "id": "ceiling", "screens": ["ceiling"] }
  ]
}
